TYPE,CONTENT,DESCRIPTION,PRIORITY,INDENT,AUTHOR,RESPONSIBLE,DATE,DATE_LANG,TIMEZONE
task,DD-III: State Reduction and Assignment (1/1),,2,,,,2024-02-01,en,
task,DSA-IV: Shortest-Path Algorithms: Dijkstra’s algorithm (1/1),,2,,,,2024-02-01,en,
task,DD-IV: Reduction of State and Flow Tables (1/1),,2,,,,2024-02-02,en,
task,DSA-V:  Hashing: Hash function (1/1),,2,,,,2024-02-02,en,
task,DD-V: Error Detection and Correction (1/1),,2,,,,2024-02-03,en,
task,DSA-III:  Binary trees: Expression trees (1/1),,2,,,,2024-02-03,en,
task,DD-V: Sequential Programmable Devices.  (1/1),,2,,,,2024-02-04,en,
task,DSA-III:  Priority Queues: Binary heap. (1/1),,2,,,,2024-02-04,en,
